sentence,label
olive oil major component mediterranean diet suggested beneficial counteract alzheimer disease,1
capsinoids nonpungent chili pepper cultivar reported reduce body fat mass promote metabolism improve unidentified complaint chill,1
recently demonstrated whey protein wp combined low dietary fiber improved lipemia risk factor cardiovascular disease subject abdominal obesity,1
rates osteoporosis significantly lower region world olive oil consumption dietary cornerstone,1
tea consumption positive effect skeletal system prevents postmenopausal osteoporosis mainly inhibiting osteoclastogenesis,1
xuezhikang xzk extract derived red yeast rice commonly employed traditional chinese medicine treating coronary heart disease improving endothelial function decreasing blood lipid preventing cardiovascular event within china globally,1
milk dairy product may contribute prevention physical cognitive impairment,1
bredemolic acid ba isomer maslinic acid reported ameliorate intermediate hyperglycaemia found prediabetes however effect triterpene cardiovascular function yet determined,1
cardiac protection blend cpb nutrient including medium chain triglyceride fish oil key nutrient developed slow progression canine myxomatous mitral valve disease mmvd,1
the health benefit garlic including inhibition carcinogenesis supported several epidemiologic laboratory finding,1
influence proteincontaining dust worker result respiratory disease,0
the preventive effect highdose regularfish oil fo bone loss aging demonstrated effect lowdose highly purified concentrated fo cfo elucidated,1
allium hirtifolium boiss astragalus hamosus mentioned iranian traditional medicine documentation therapy kind dementia feature symptom similar alzheimer disease ad,1
in case acquired cutis laxa associated neoplasm drug autoimmune disease,0
date fruit phoenix dactylifera traditionally used medicine many culture treatment range ailment stomach intestinal disorder fever oedema bronchitis wound healing,1
the beneficial effect olive oil phenol attributed variety biological activity including free radical scavengingantioxidant action antiinflammatory effect anticarcinogenic property antimicrobial activity,1
onion allium cepa handling induce contact dermatitis rhinoconjunctivitis asthma,0
catechins phytochemical contained mainly green tea exhibit antiviral activity various acute infectious disease experimentally,1
the hypothesis vitamin food rich vitamin milk protects development airway obstruction tested subsample data national health nutrition examination survey,1
epidemiological clinical study compellingly showed ability mediterranean diet rich extravirgin olive oil evoo reduce multiple disease cancer cardiovascular disease aging cognitive function decline,1
three recent metaanalyses found significant prospective inverse association chocolate intake cardiovascular disease risk,1
some bath oil skin cream used treating ad contain peanut oil suggested exposure peanut allergen disrupted skin barrier potential cause pa,1
flavonoid antioxidant phenylchroman structure quercetin kaempferol myricetin apigenin luteolin constituent fruit vegetable tea wine may reduce coronary disease cancer described,1
oats product believed contain many bioactives posse potential beneficial property chronic disease,1
lowgrade inflammation suggested mechanism development metabolic syndrome mets diet could act regulator,1
food supplementation fiber mix guar gum chickpea flour represents promising approach reduce risk type diabetes mellitus tdm attenuating postprandial glycemia,1
there several report describing allergy hydrolyzed wheat product,0
turmeric curcuma longa traditionally used treat pain fever allergic inflammatory disease bronchitis arthritis dermatitis,1
increased consumption processed food modern world contributed high salt intake thus increased prevalence hypertension among malaysian population,0
previously identified nobiletin citrus peel natural compound possessing antidementia activity,1
epidemiological clinical study compellingly documented ability mediterranean diet rich extravirgin olive oil evoo reduce breast colon cancer incidence cardiovascular disease aging cognitive function decline,1
dietary approaches stop hypertension dash lowsodium fruitsvegetablesrich diet associated lower risk nephrolithiasis due altered urinary biochemistry,1
diets high salt leading risk death disability globally,0
almond kernel contain phytochemical positive health effect relation heart disease diabetes obesity,1
we previously demonstrated consumption isoalphaacids iaa hopderived bitter compound beer prevents formation disease pathology transgenic mouse model alzheimer disease ad,1
the intake milk milk product could increase risk ovarian carcinoma,0
the common food reported trigger oral ulcer eggplant melon walnut cantaloupe,0
it hypothesized chicken eggshell membrane em effective regeneration cartilage andor immunomodulation oral tolerance relief pain stiffness joint commonly affected arthritis,1
diet based adequate intake calcium mg per day containment animal protein salt decrease significantly urinary supersaturation calcium oxalate reduce relative risk stone recurrence hypercalciuric renal stone former,1
however also evidence detrimental effect milk risk hip fracture,1
high fructose corn syrup hfcs sweetened soft drink intake linked asthma us highschoolers,0
epidemiological study compellingly documented ability mediterranean diet rich extravirgin olive oil reduce incidence certain malignancy cardiovascular disease slow alzheimer disease progression,1
we also showed moderate consumption wine associated lower risk developing ad,1
baker rhinitis kind occupational allergic rhinitis mainly caused intranasal exposure wheat andor rye flour bakery worker,0
these finding suggest rural china anemia stem poor quality diet infantstoddlers rather insufficient quantity food consumed,0
there evidence adequate amount folic acid supply woman early pregnancy decrease risk neural tube defect affected child,1
nuts appreciable antioxidant load evidence positive effect several chronic disease incidence death rate,1
the consumption dairy product older people may reduce risk frailty especially high consumption lowfat milk yogurt may also reduce risk sarcopenia improving skeletal muscle mass addition nutrientrich dairy protein ricotta cheese habitual diet,1
although calcium supplementation cause hypercalciuria risk nephrolithiasis shown decrease rather increase among subject higher calcium intake,0
wheat one major crop grown processed consumed humankind associated intolerance notably coeliac disease allergy,0
adequate consumption fruit vegetable protective benefit development coronary heart disease hypertension chronic obstructive pulmonary disease,1
although high intake plant food fruit vegetable whole grain nut legume recommended chronic disease prevention unclear optimal amount intake food whether specific subtypes particularly beneficial,1
blueberry consumption prevent obesitylinked metabolic disease proposed polyphenol content blueberry may contribute effect,1
longterm fish oil fo supplementation able improve alzheimer disease ad pathology,1
here identified zajoene sulfur containing compound isolated crushed garlic inhibitor colon cancer cell growth,1
mushrooms reported folklore management alzheimer disease ad diabetes limited scientific prove,1
saturated fat added salt excessive energy drink consumption appear harmful patient rhythm disorder,0
new symptom hypersensitivity caused chemotherapy drug monoclonal antibody biological agent suggested recognized anaphylaxis phenotype,0
fruit vegetable consumption considered protective effect cardiovascular cerebrovascular disease cvds,1
major component zingiber officinale previously reported ameliorate hyperglycemia type diabetic mouse,1
the fruit lycium chinense lc one popular natural material used counter effect musculoskeletal disease oriental medicine,1
cigarette smoke cs cause death year worldwide wellknown harmful effect human body leading heart disease stroke lung cancer cardiovascular problem,0
vitamin ginger effective nausea vomiting early pregnancy,1
beer consumption inversely associated risk kidney stone bottle beer consumed per day estimated reduce risk rr ci,1
the leaf fruit rhus coriaria traditionally used turkey treatment diabetes,1
although soy considered major food allergen along milk egg peanut fish wheat prevalence soy allergy pediatric population well defined,0
consumption soy food associated protection cardiometabolic disease mechanism incompletely understood,1
consumption olive olea europaea including table olive oil associated low incidence inflammationrelated disease,1
high educational level vegetablebased diet tea protective factor vd,1
the reported incidence osteoporosis lower country mediterranean diet predominates apparent relationship may mediated phenolic compound present olive oil,1
the soluble dietary fiber mixed linked betadglucan cereal grain valuable component healthy diet reduces risk coronary disease diabetes,1
plant nutrient plantbased diet could beneficial effect patient ckd increased fibre intake shift gut microbiota towards reduced production uraemic toxin plant fat particularly olive oil antiatherogenic effect plant anion might mitigate metabolic acidosis slow ckd progression plant phosphorus lower bioavailability animal phosphorus plantbased diet might enable better control hyperphosphataemia,1
several epidemiological preclinical study supported protective effect coffee alzheimer disease ad,1
recent study suggest dietary virgin olive oil reduces hypoxiareoxygenation injury rat brain,1
bakers exposed daily flour may susceptible immunologic occupational disease,0
wheat maize corn flour staple crop consumed widely throughout world fortified folic acid country prevent neural tube defect,1
the csppt china stroke primary prevention trial demonstrated significant risk reduction first stroke hypertensive patient treated enalapril plus folic acid compared enalapril alone lifetime strokefree survival associated treatment unknown,1
therefore novel therapeutic strategy long investigated curcumin curcuma longa shown property prevent deleterious process involved neurodegenerative disease,1
milk often seen potential promotor atherosclerosis coronary heart disease source cholesterol saturated fatty acid,0
hydroxytyrosol acetate htac polyphenolic compound olive oil exerts antiinflammatory effect murine collageninduced arthritis,1
allergen glb important allergen rice cause allergic reaction asthma atopic dermatitis,0
exposure wheat flour guar gum wellknown cause occupational respiratory allergy among worker food processing industry,0
docosahexaenoic acid dha fatty acid abundant brain reported protective effect alzheimer disease although mechanistic effect dha alzheimer pathophysiology remain unclear,1
irondeficiency anemia ida major global public health problem iron fortifiers diet clearly needed prevention improvement ida human,1
adults aged year older epilepsy face increased risk fracture associated age use antiepileptic drug,0
eucalyptol cineole major constituent eucalyptus oil eo used traditional medicine remedy cold bronchitis,1
further waste product tropical fruit including mangosteen rind coffee pulp spent coffee ground provide option reduce metabolic syndrome,1
citrus unshiu rutaceae easypeeling citrus fruit used traditional korean medicine improving skin elasticity relieving fatigue cough preventing bronchitis flu various cancer,1
regular intake food rich saturated fat meat certain dairy product raise risk coronary heart disease especially smoker,0
besides foodadditive function ginger long history medicinal use treatment variety human ailment including common cold fever rheumatic disorder gastrointestinal complication motion sickness diabetes cancer etc,1
osteoporosis common skeletal disorder human gelatin hydrolysate mammal reported improve osteoporosis,1
irondeficiency anemia important health problem global public issue development iron fortifiers diet essential decrease iron deficiency,1
nickel common cause contact allergy general population frequently detected allergen patient patch tested suspected allergic contact dermatitis acd,0
brassica specie broccoli particular associated reduced risk several important cancer,1
several clinical epidemiological experimental evidence suggest consumption mediet reduces incidence certain pathology related oxidative stress chronic inflammation immune system disease cancer atherosclerosis cardiovascular disease cvd,1
in rice allergy protein molecular mass kda demonstrated potentially allergenic,0
oleuropein component extra virgin olive oil evoo reduces postprandial glycemia mechanism counteracting oxidative stressmediated incretin downregulation,1
the nutrition pyramid described narrative review hypothetical even light several limitation present review main limitation fact date randomized controlled trial literature clearly showing improved nutrition via regulation carbon dioxide producedoxygen consumed inflammation oxidative stress improves symptom andor progression copd,1
thus inclusion food source dietary antioxidant different kind nut may improve biomarkers related oxidative stress contributing possible reduction atherosclerosis progression,1
natural product like ginger turmeric garlic onion cinnamon lemon neem basil black pepper scientifically proven therapeutic benefit acute respiratory tract infection including pulmonary fibrosis diffuse alveolar damage pneumonia acute respiratory distress syndrome well associated septic shock lung kidney injury symptom associated covid infection,1
growing body evidence including study support protective effect oleocanthal oc extravirgin olive oil evoo early ad stage onset pathology,1
osteopenia osteoporosis occurs frequently alcoholic patient alcoholic fatty liver disease,0
fruit vegetable intake associated reduced risk cardiovascular disease,1
dietary excess animal protein andor salt implicated risk factor calcium oxalate urolithiasis,0
the mediterranean diet md affect risk myocardial infarction longterm prognosis coronary event,0
epidemiological study shown higher sugarsweetened beverage consumption associated increased risk developing chronic disease including cardiovascular disease type diabetes mellitus obesity nonalcoholic fatty liver disease gout rheumatoid arthritis worse symptom patient rheumatoid arthritis,0
components germ layer bran brown rice br help maintain good health prevent ad,1
sword bean known traditional medicinal plant treat cancer sinus infection suppurative disease,1
current dietary guideline recommend patient chronic kidney disease ckd restrict individual nutrient sodium potassium phosphorus protein,0
